<?xml version="1.0" encoding="UTF-8"?>
<candies xmlns:xsi="http://www.w3.org/2001/XMLSchema-instance"
         xmlns="candies"
         xsi:noNamespaceSchemaLocation="candy.xsd">

    <name id="1">The cow</name>
    <energy>100</energy>
    <type>
        <type-name>Chocolate</type-name>
        <have-filling>Yes</have-filling>
    </type>
    <ingredients>
        <water>10</water>
        <sugar>15</sugar>
        <fructose>25</fructose>
        <chocolate-type>Black</chocolate-type>
        <vanillin>9</vanillin>
    </ingredients>
    <value>
        <proteins>10</proteins>
        <fats>15</fats>
        <carbohydrates>30</carbohydrates>
    </value>
    <production country="Russia">Roshen</production>

</candies>